"Status","Start Time","Stop Time","Duration in ms","Parent Suite","Suite","Sub Suite","Test Class","Test Method","Name","Description"
"failed","Mon Jan 01 05:42:48 GMT 2024","Mon Jan 01 05:44:04 GMT 2024","75977","","Weather Shopper Website","","","","Shopping for Sunscreens in Hot Weather",""
"failed","Mon Jan 01 05:36:26 GMT 2024","Mon Jan 01 05:36:31 GMT 2024","4908","","Website Navigation","","","","Check Body section is loaded correctly",""
"failed","Mon Jan 01 05:39:22 GMT 2024","Mon Jan 01 05:40:38 GMT 2024","75500","","Weather Shopper Website","","","","Shopping for Moisturizers in Cold Weather",""
"failed","Mon Jan 01 05:46:40 GMT 2024","Mon Jan 01 05:47:48 GMT 2024","67357","","Weather Shopper Website","","","","No Shopping Action Required in Moderate Weather",""
"passed","Mon Jan 01 05:36:00 GMT 2024","Mon Jan 01 05:36:10 GMT 2024","10431","","Website Navigation","","","","Verify Home Menu Navigation Item and Components",""
"passed","Mon Jan 01 05:36:10 GMT 2024","Mon Jan 01 05:36:16 GMT 2024","6065","","Website Navigation","","","","Check Footer section is loaded correctly",""
