"Status","Start Time","Stop Time","Duration in ms","Parent Suite","Suite","Sub Suite","Test Class","Test Method","Name","Description"
"failed","Sat Dec 23 21:11:49 GMT 2023","Sat Dec 23 21:12:54 GMT 2023","65423","","Weather Shopper Website","","","","Shopping for Moisturizers in Cold Weather",""
"failed","Sat Dec 23 21:09:09 GMT 2023","Sat Dec 23 21:09:14 GMT 2023","4910","","Website Navigation","","","","Check Body section is loaded correctly",""
"passed","Sat Dec 23 21:08:28 GMT 2023","Sat Dec 23 21:08:55 GMT 2023","26485","","Website Navigation","","","","Verify Home Menu Navigation Item and Components",""
"failed","Sat Dec 23 21:18:45 GMT 2023","Sat Dec 23 21:19:59 GMT 2023","73857","","Weather Shopper Website","","","","No Shopping Action Required in Moderate Weather",""
"passed","Sat Dec 23 21:08:55 GMT 2023","Sat Dec 23 21:09:00 GMT 2023","4553","","Website Navigation","","","","Check Footer section is loaded correctly",""
"failed","Sat Dec 23 21:15:08 GMT 2023","Sat Dec 23 21:16:23 GMT 2023","74561","","Weather Shopper Website","","","","Shopping for Sunscreens in Hot Weather",""
